{
 "name": "baseline",
 "description": "Common, three-phase inverter, nameplate, controls, a repeating MPPT group",
 "unitId": 1,
 "baseAddress": 40000,
 "models": [
  {
   "ID": 1,
   "Mn": "OT Fabric",
   "Md": "Interop Device",
   "Opt": "opt-a",
   "Vr": "1.2.3",
   "SN": "SN-0001",
   "DA": 1
  },
  {
   "ID": 103,
   "A": 123,
   "AphA": 41,
   "AphB": 42,
   "AphC": 40,
   "A_SF": -1,
   "PPVphAB": 4000,
   "PPVphBC": 4010,
   "PPVphCA": 3990,
   "PhVphA": 2301,
   "PhVphB": 2302,
   "PhVphC": 2299,
   "V_SF": -1,
   "W": 500,
   "W_SF": 1,
   "Hz": 6001,
   "Hz_SF": -2,
   "VA": 520,
   "VA_SF": 1,
   "VAr": -30,
   "VAr_SF": 1,
   "PF": -985,
   "PF_SF": -1,
   "WH": 1234567,
   "WH_SF": 0,
   "DCA": 101,
   "DCA_SF": -1,
   "DCV": 3805,
   "DCV_SF": -1,
   "DCW": 515,
   "DCW_SF": 1,
   "TmpCab": 455,
   "Tmp_SF": -1,
   "St": 4,
   "StVnd": 2,
   "Evt1": 3,
   "Evt2": 0,
   "EvtVnd1": 0,
   "EvtVnd2": 0,
   "EvtVnd3": 0,
   "EvtVnd4": 0
  },
  {
   "ID": 120,
   "DERTyp": 4,
   "WRtg": 1000,
   "WRtg_SF": 1,
   "VARtg": 1100,
   "VARtg_SF": 1,
   "VArRtgQ1": 400,
   "VArRtgQ2": 400,
   "VArRtgQ3": -400,
   "VArRtgQ4": -400,
   "VArRtg_SF": 1,
   "ARtg": 250,
   "ARtg_SF": -1,
   "PFRtgQ1": -90,
   "PFRtgQ2": -90,
   "PFRtgQ3": 90,
   "PFRtgQ4": 90,
   "PFRtg_SF": -2
  },
  {
   "ID": 123,
   "Conn": 1,
   "WMaxLimPct": 500,
   "WMaxLimPct_WinTms": 10,
   "WMaxLim_Ena": 1,
   "OutPFSet": -95,
   "OutPFSet_Ena": 0,
   "VArWMaxPct": 100,
   "VArPct_Mod": 1,
   "VArPct_Ena": 0,
   "WMaxLimPct_SF": -1,
   "OutPFSet_SF": -2,
   "VArPct_SF": -1
  },
  {
   "ID": 160,
   "DCA_SF": -2,
   "DCV_SF": -1,
   "DCW_SF": 0,
   "DCWH_SF": 0,
   "Evt": 0,
   "N": 2,
   "TmsPer": 60,
   "module": [
    {
     "ID": 1,
     "IDStr": "string-1",
     "DCA": 512,
     "DCV": 3805,
     "DCW": 195,
     "DCWH": 100000,
     "Tms": 1000,
     "Tmp": 25,
     "DCSt": 4,
     "DCEvt": 0
    },
    {
     "ID": 2,
     "IDStr": "string-2",
     "DCA": 300,
     "DCV": 3811,
     "DCW": 0,
     "DCWH": 90000,
     "Tms": 1000,
     "Tmp": -7,
     "DCSt": 2,
     "DCEvt": 1
    }
   ]
  }
 ]
}
