{
 "name": "edge",
 "description": "Base address 0, full-width strings, not-implemented values, extreme scale factors, 64-bit accumulators",
 "unitId": 7,
 "baseAddress": 0,
 "models": [
  {
   "ID": 1,
   "Mn": "MMMMMMMMMMMMMMMMMMMMMMMMMMMMMMMM",
   "Md": "Interop Device",
   "Opt": "opt-a",
   "Vr": "1.2.3",
   "SN": "SN-0002-THIRTY-TWO-CHARACTERS-XX",
   "DA": 1
  },
  {
   "ID": 101,
   "A": 65534,
   "AphA": 0,
   "A_SF": -3,
   "PhVphA": 2305,
   "V_SF": 3,
   "W": -32767,
   "W_SF": 0,
   "Hz": 5000,
   "Hz_SF": -2,
   "WH": 1,
   "WH_SF": 0,
   "St": 1
  },
  {
   "ID": 701,
   "ACType": 3,
   "St": 2,
   "Alrm": 0,
   "W": -9800,
   "VA": 10000,
   "Var": 200,
   "PF": 985,
   "A": 411,
   "LLV": 2400,
   "LNV": 2400,
   "Hz": 60010,
   "TotWhInj": 18446744073709551,
   "TotWhAbs": 1,
   "TotVarhInj": 9,
   "TotVarhAbs": 3,
   "A_SF": -1,
   "V_SF": -1,
   "Hz_SF": -3,
   "W_SF": 0,
   "PF_SF": -3,
   "VA_SF": 0,
   "Var_SF": 0,
   "TotWh_SF": 0,
   "TotVarh_SF": 0
  }
 ]
}
